{"result_version":"1.0","outcome":"delivered","reason_code":"read_delivered","content":"safe","content_sha256":"75c75efe327a036499b0b0bf8d2e57a4cd8e15e6d029c21a76a69e4fa6e93a12","bytes_read":4,"taint":{"classification":"untrusted_workspace_file","cannot_authorize":true},"provenance":{"runtime_version":"1.0","workspace_id":"workspace-1","snapshot_digest":"aaaaaaaaaaaaaaaaaaaaaaaaaaaaaaaaaaaaaaaaaaaaaaaaaaaaaaaaaaaaaaaa"}}
